<!ELEMENT lessons (lesson*)> 
<!ELEMENT lesson (LessonTitle, TutorLastName, LessonTime, LessonStartDate, LessonEndDate)> 
<!ELEMENT LessonTitle (#PCDATA)> 
<!ELEMENT TutorLastName (#PCDATA)> 
<!ELEMENT LessonTime (#PCDATA)> 
<!ELEMENT LessonStartDate (#PCDATA)> 
<!ELEMENT LessonEndDate (#PCDATA)>
<!ATTLIST lesson id CDATA #REQUIRED>
